{
  "$schema": "https://ui.shadcn.com/schema/registry-item.json",
  "name": "list-row",
  "type": "registry:ui",
  "title": "ListRow",
  "description": "A row of a list, one thing said in a line: ListRow for a fact, RowButton for a choice.",
  "dependencies": [
    "@base-ui/react",
    "dowel-ui@^0.33.0"
  ],
  "registryDependencies": [],
  "files": [
    {
      "path": "ui/list-row.tsx",
      "target": "@ui/list-row.tsx",
      "type": "registry:ui",
      "content": "import type { HTMLAttributes, ReactNode } from 'react'\nimport { useRender } from '@base-ui/react/use-render'\nimport { cn } from 'dowel-ui'\n\n/*\n * ListRow and RowButton.\n *\n * A row of a list, one thing said in a line: ListRow for a fact, RowButton for\n * a choice.\n *\n * Every screen of every product has a list of something - versions, releases,\n * a queue, a journal - and each drew its own row: kilna alone had six\n * list-and-detail layouts with five different row recipes, and the selected\n * row was tinted four different ways. The row is three slots and a rule\n * about truncation, which is small enough to get wrong every time and\n * exactly why it is here.\n *\n * Two components, because a row is either a fact or a choice:\n *\n * - `ListRow` is a fact - \"Clip, 02.09\" in a list of releases. It is not\n *   pressable, has no hover, and rows in a run are divided by a hairline.\n * - `RowButton` is a choice - a version in the list beside the editor, an\n *   item in a queue. It is a real `<button>` (or the product's link, through\n *   `render`), it answers the pointer, and the one that is open is tinted on\n *   `accent-soft` - the mockup's `.vrow.on` - and named as current, because\n *   the tint alone says it to nobody who cannot see it.\n *\n * The slots are the same in both: `start` for the thing that identifies the\n * row at a glance (an icon, a status dot, a cover), the row's words with an\n * optional `description` under them, and `end` for what is measured about it\n * (a date, a count, a chip). The words truncate on one line and the slots do\n * not shrink: a list whose rows grow to two lines in one language and not in\n * the other stops being a list you can scan.\n */\n\nconst slots = {\n  start: 'flex shrink-0 items-center text-dim [&_svg:not([class*=size-])]:size-4',\n  end: 'ml-auto flex shrink-0 items-center gap-1.5 text-xs text-faint tabular-nums',\n} as const\n\ninterface RowSlots {\n  /** What identifies the row at a glance: an icon, a status dot, a cover. */\n  start?: ReactNode\n  /** A second line under the words, quieter and truncated the same way. */\n  description?: ReactNode\n  /** What is measured about the row: a date, a count, a chip. */\n  end?: ReactNode\n  /** The row's words. */\n  children: ReactNode\n}\n\nfunction RowBody({ start, description, end, children, strong }: RowSlots & { strong?: boolean }) {\n  return (\n    <>\n      {start === undefined ? null : (\n        <span data-slot=\"start\" className={slots.start}>\n          {start}\n        </span>\n      )}\n      {/* `min-w-0` because a flex child refuses to shrink below its content\n          without it - and a row that does not shrink pushes its `end` out of\n          the list instead of truncating its words. */}\n      <span className=\"flex min-w-0 flex-1 flex-col\">\n        <span className={cn('truncate', strong && 'font-semibold')}>{children}</span>\n        {description === undefined ? null : <span className=\"truncate text-xs text-faint\">{description}</span>}\n      </span>\n      {end === undefined ? null : <span className={slots.end}>{end}</span>}\n    </>\n  )\n}\n\nexport interface ListRowProps extends RowSlots, Omit<HTMLAttributes<HTMLElement>, 'children'> {\n  /** Something other than a `div` - an `<li>` in a `<ul>`, most often:\n   * `render={<li />}`. */\n  render?: useRender.RenderProp\n}\n\n/**\n * A row that states a fact. Rows in a run are divided by a hairline that the\n * last one does not draw, so a list inside a panel ends at the panel's edge\n * rather than on a line of its own.\n *\n * Its height comes from `py-row`, so a list follows `data-density` with the\n * table beside it.\n */\nexport function ListRow({ start, description, end, children, render, className, ...props }: ListRowProps) {\n  return useRender({\n    render,\n    defaultTagName: 'div',\n    props: {\n      className: cn(\n        'flex min-w-0 items-center gap-2.5 border-b border-line px-3 py-row text-sm text-text last:border-b-0',\n        className,\n      ),\n      children: (\n        <RowBody start={start} description={description} end={end}>\n          {children}\n        </RowBody>\n      ),\n      ...props,\n    },\n  })\n}\n\nexport interface RowButtonProps extends RowSlots, Omit<HTMLAttributes<HTMLElement>, 'children'> {\n  /** The open one - tinted, and named as current. */\n  selected?: boolean\n  /** The element to draw the row as - a router's link, most often:\n   * `render={<NavLink to={…} />}`. Without it the row is a `<button>`. */\n  render?: useRender.RenderProp\n  disabled?: boolean\n}\n\n/**\n * A row that is a choice.\n *\n * `aria-current` says which one is open, the way a list beside an editor\n * works: the row is where you are, not a value you are submitting. A product\n * that puts rows in a `listbox` passes `aria-selected` instead, and the\n * attribute it passes wins.\n */\nexport function RowButton({\n  start,\n  description,\n  end,\n  children,\n  selected = false,\n  render,\n  disabled,\n  className,\n  ...props\n}: RowButtonProps) {\n  return useRender({\n    render,\n    defaultTagName: 'button',\n    props: {\n      // A `<button>` inside a form submits it unless told otherwise, and a\n      // list of rows inside a settings form is where that bites.\n      ...(render === undefined ? { type: 'button', disabled } : {}),\n      'aria-current': selected ? 'true' : undefined,\n      className: cn(\n        'flex w-full min-w-0 cursor-pointer items-center gap-2.5 rounded-md px-2.5 py-1.5 text-left text-sm text-text no-underline',\n        'transition-colors hover:bg-soft',\n        'focus-visible:outline-2 focus-visible:outline-offset-1 focus-visible:outline-accent',\n        'disabled:cursor-not-allowed disabled:opacity-50',\n        // The open row's icon takes the accent, as a NavRail entry's does.\n        selected && 'bg-accent-soft hover:bg-accent-soft [&>[data-slot=start]]:text-accent',\n        className,\n      ),\n      children: (\n        <RowBody start={start} description={description} end={end} strong>\n          {children}\n        </RowBody>\n      ),\n      ...props,\n    },\n  })\n}\n"
    }
  ]
}
