{
  "$schema": "https://ui.shadcn.com/schema/registry-item.json",
  "name": "empty-state",
  "type": "registry:ui",
  "title": "Empty-state",
  "description": "Three kinds of nothing, and a product that draws the same panel for all three is telling the reader the wrong thing twice:\n *   **empty** - there is nothing here yet, and that is normal. The panel says   what would be here and offers the one action that makes it appear.",
  "dependencies": [
    "class-variance-authority",
    "dowel-ui@^0.26.0"
  ],
  "registryDependencies": [],
  "files": [
    {
      "path": "ui/empty-state.tsx",
      "target": "@ui/empty-state.tsx",
      "type": "registry:ui",
      "content": "import type { HTMLAttributes, ReactNode } from 'react'\nimport { cva, type VariantProps } from 'class-variance-authority'\nimport { cn } from 'dowel-ui'\n\n/*\n * What a screen says when there is nothing on it.\n *\n * Three kinds of nothing, and a product that draws the same panel for all\n * three is telling the reader the wrong thing twice:\n *\n *   **empty** - there is nothing here yet, and that is normal. The panel says\n *   what would be here and offers the one action that makes it appear.\n *\n *   **filtered** - there is plenty here, just none of it matching. The way out\n *   is to widen the filter, not to create anything.\n *\n *   **error** - it could not be fetched. Nothing is missing; something failed,\n *   and the way out is to try again.\n *\n * They differ in what the reader should do next, which is exactly what an\n * empty screen is for, so they are a variant rather than three components.\n *\n * `action` is the whole point of the component: **an empty screen with no way\n * out is a dead end.** It is optional in the type because a panel inside a\n * larger screen can borrow the way out from its surroundings - but a full-page\n * empty state without one is a bug the reader cannot report.\n *\n * The mark is the line's hexagon, drawn in the current text colour rather than\n * a product's accent. A full-strength logo in an empty panel shouts; this is a\n * watermark, and it is `aria-hidden` because it says nothing a reader needs.\n */\n\nexport const emptyStateVariants = cva(\n  'flex flex-col items-center justify-center gap-3 rounded-xl p-8 text-center',\n  {\n    variants: {\n      variant: {\n        empty: 'border border-dashed border-line-2',\n        filtered: 'border border-dashed border-line-2',\n        // Solid rather than dashed: a dashed border reads as a placeholder for\n        // something that belongs there, and a failure is not that.\n        error: 'border border-bad/40 bg-bad-soft/30',\n      },\n    },\n    defaultVariants: { variant: 'empty' },\n  },\n)\n\n/** The line's hexagon, at whatever size the caller asks for.\n *\n * Inlined rather than fetched: it is decorative, so it should not cost a\n * request, and it has to take the theme's colour - a file could not. */\nexport function EmptyMark({ className }: { className?: string }) {\n  return (\n    <svg viewBox=\"0 0 100 100\" aria-hidden className={cn('size-14', className)}>\n      <polygon\n        points=\"50,5 89,27.5 89,72.5 50,95 11,72.5 11,27.5\"\n        fill=\"none\"\n        stroke=\"currentColor\"\n        strokeWidth={6}\n        strokeLinejoin=\"round\"\n      />\n    </svg>\n  )\n}\n\n/** The same hexagon, cut by a slash. For a filter that matched nothing: the\n * shape is there, the contents are not. */\nexport function FilteredMark({ className }: { className?: string }) {\n  return (\n    <svg viewBox=\"0 0 100 100\" aria-hidden className={cn('size-14', className)}>\n      <polygon\n        points=\"50,5 89,27.5 89,72.5 50,95 11,72.5 11,27.5\"\n        fill=\"none\"\n        stroke=\"currentColor\"\n        strokeWidth={6}\n        strokeLinejoin=\"round\"\n      />\n      <line x1=\"22\" y1=\"78\" x2=\"78\" y2=\"22\" stroke=\"currentColor\" strokeWidth={6} strokeLinecap=\"round\" />\n    </svg>\n  )\n}\n\n/** A hexagon with a corner broken out of it. For something that failed. */\nexport function ErrorMark({ className }: { className?: string }) {\n  return (\n    <svg viewBox=\"0 0 100 100\" aria-hidden className={cn('size-14', className)}>\n      <polyline\n        points=\"50,5 89,27.5 89,72.5 50,95 11,72.5 11,27.5 50,5\"\n        fill=\"none\"\n        stroke=\"currentColor\"\n        strokeWidth={6}\n        strokeLinejoin=\"round\"\n        strokeLinecap=\"round\"\n        // The gap is the break: the outline is drawn as a line rather than a\n        // closed shape so one edge can be missing.\n        strokeDasharray=\"150 34\"\n      />\n    </svg>\n  )\n}\n\nexport interface EmptyStateProps\n  extends Omit<HTMLAttributes<HTMLDivElement>, 'title'>,\n    VariantProps<typeof emptyStateVariants> {\n  /** What is not here, in the product's words. */\n  title: ReactNode\n  /** Why, or what to do about it. */\n  body?: ReactNode\n  /** The one thing worth doing here. An empty screen with no way out is a\n   * dead end. */\n  action?: ReactNode\n  /** Something other than the default mark - a product's own illustration. */\n  mark?: ReactNode\n}\n\nexport function EmptyState({\n  variant = 'empty',\n  title,\n  body,\n  action,\n  mark,\n  className,\n  ...props\n}: EmptyStateProps) {\n  const defaultMark =\n    variant === 'error' ? (\n      <ErrorMark className=\"text-bad/60\" />\n    ) : variant === 'filtered' ? (\n      <FilteredMark className=\"text-line-2\" />\n    ) : (\n      <EmptyMark className=\"text-line-2\" />\n    )\n\n  return (\n    <div className={cn(emptyStateVariants({ variant }), className)} {...props}>\n      {mark ?? defaultMark}\n      <div>\n        <p className={cn('font-medium', variant === 'error' && 'text-bad')}>{title}</p>\n        {body !== undefined && <p className=\"mt-1 text-sm text-dim\">{body}</p>}\n      </div>\n      {action}\n    </div>\n  )\n}\n"
    }
  ]
}
