{
  "$schema": "https://ui.shadcn.com/schema/registry-item.json",
  "name": "toast",
  "type": "registry:ui",
  "title": "Toast",
  "description": "For something that already happened and needs no decision. Anything that needs an answer is a dialog - a toast that asks a question is a question the reader can miss by looking away.",
  "dependencies": [
    "@base-ui/react",
    "class-variance-authority",
    "dowel-ui@^0.17.0"
  ],
  "registryDependencies": [],
  "files": [
    {
      "path": "ui/toast.tsx",
      "target": "@ui/toast.tsx",
      "type": "registry:ui",
      "content": "import { Toast as Base } from '@base-ui/react/toast'\nimport { cva, type VariantProps } from 'class-variance-authority'\nimport { cn } from 'dowel-ui'\n\n/*\n * Toast.\n *\n * For something that already happened and needs no decision. Anything that\n * needs an answer is a dialog - a toast that asks a question is a question the\n * reader can miss by looking away.\n *\n * The tone is on the toast rather than in five separate components, because\n * the difference between \"saved\" and \"could not save\" is emphasis, never\n * meaning: the sentence says which it is, and a reader who cannot separate\n * green from red gets the same message. The stripe down the side exists for\n * the same reason a badge carries a word.\n *\n * `Toast.Root` is `role=\"dialog\"` inside a `role=\"region\"` viewport, and Base\n * UI drives the live region, the timers, the pause on hover and focus, and the\n * swipe. What is here is the clothes and the vocabulary.\n */\n\nexport const toastVariants = cva(\n  [\n    'relative w-[min(22rem,calc(100vw-2rem))] overflow-hidden',\n    'rounded-lg border border-line bg-raise p-3 pl-4 text-text shadow-float',\n    // The stripe. `before` rather than a border, so the corner radius stays\n    // the panel's own.\n    'before:absolute before:inset-y-0 before:left-0 before:w-1',\n    '[transition:opacity_var(--duration-base)_var(--ease-out),transform_var(--duration-base)_var(--ease-out)]',\n    'data-[starting-style]:translate-x-4 data-[starting-style]:opacity-0',\n    'data-[ending-style]:translate-x-4 data-[ending-style]:opacity-0',\n  ],\n  {\n    variants: {\n      tone: {\n        neutral: 'before:bg-line-2',\n        good: 'before:bg-good',\n        warn: 'before:bg-warn',\n        bad: 'before:bg-bad',\n        info: 'before:bg-info',\n      },\n    },\n    defaultVariants: { tone: 'neutral' },\n  },\n)\n\n/** Wraps the part of the application that can raise a toast. One per screen;\n * nesting them gives a product two queues that do not know about each other. */\nexport const ToastProvider = Base.Provider\n\n/** The manager: `add`, `update`, `close`, and `promise` for the common case of\n * \"say this while it runs, that when it lands\". */\nexport const useToastManager = Base.useToastManager\n\n/** A toast raised outside React - from a store, an event handler, a worker.\n * Pass the result to `ToastProvider`'s `toastManager`. */\nexport const createToastManager = Base.createToastManager\n\n/** The heading. Base UI points the toast's `aria-labelledby` at it. */\nexport function ToastTitle({ className, ...props }: Base.Title.Props) {\n  return <Base.Title className={cn('text-sm font-semibold', className)} {...props} />\n}\n\n/** The sentence under it, and the toast's `aria-describedby`. */\nexport function ToastDescription({ className, ...props }: Base.Description.Props) {\n  return <Base.Description className={cn('mt-0.5 text-xs text-dim', className)} {...props} />\n}\n\n/** The one thing the reader can do about it: undo, or go and look. */\nexport function ToastAction({ className, ...props }: Base.Action.Props) {\n  return (\n    <Base.Action\n      className={cn(\n        'mt-2 inline-flex h-7 cursor-pointer items-center rounded-md px-2 text-xs font-medium',\n        'bg-accent-soft text-accent transition-colors hover:bg-accent-soft/60',\n        'focus-visible:outline-2 focus-visible:outline-offset-1 focus-visible:outline-accent',\n        className,\n      )}\n      {...props}\n    />\n  )\n}\n\n/** The dismiss button. Needs a word - a bare cross is announced as nothing. */\nexport function ToastClose({ className, ...props }: Base.Close.Props) {\n  return (\n    <Base.Close\n      className={cn(\n        'absolute right-2 top-2 grid size-6 cursor-pointer place-items-center rounded-sm',\n        'text-faint transition-colors hover:bg-soft hover:text-text',\n        'focus-visible:outline-2 focus-visible:outline-offset-1 focus-visible:outline-accent',\n        className,\n      )}\n      {...props}\n    >\n      <svg viewBox=\"0 0 16 16\" width=\"10\" height=\"10\" fill=\"none\" stroke=\"currentColor\" strokeWidth=\"2\" aria-hidden>\n        <path d=\"M4 4l8 8M12 4l-8 8\" strokeLinecap=\"round\" />\n      </svg>\n    </Base.Close>\n  )\n}\n\nexport interface ToastProps extends Base.Root.Props, VariantProps<typeof toastVariants> {}\n\n/** One toast. The tone comes from the caller or from `toast.type`, so a\n * product that raises them through the manager gets the stripe for free. */\nexport function Toast({ tone, className, toast, ...props }: ToastProps) {\n  const fromType = TONE_FOR_TYPE[toast.type ?? ''] ?? undefined\n  return (\n    <Base.Root\n      toast={toast}\n      className={cn(toastVariants({ tone: tone ?? fromType }), className)}\n      {...props}\n    />\n  )\n}\n\n/** Base UI's own `type` values, mapped onto the vocabulary. A product calling\n * `manager.add({ type: 'success' })` should not also have to say which colour\n * that is. */\nconst TONE_FOR_TYPE: Record<string, 'good' | 'warn' | 'bad' | 'info' | undefined> = {\n  success: 'good',\n  warning: 'warn',\n  error: 'bad',\n  info: 'info',\n  loading: 'info',\n}\n\nexport interface ToastViewportProps extends Base.Viewport.Props {\n  /** Where to portal to. Defaults to the document body, which is what keeps\n   * toasts above everything regardless of where they were raised from. */\n  container?: Base.Portal.Props['container']\n}\n\n/** Where they stack. Bottom right by default, which is the corner that does\n * not cover a form being filled in or a menu being read. */\nexport function ToastViewport({ container, className, ...props }: ToastViewportProps) {\n  return (\n    <Base.Portal container={container}>\n      <Base.Viewport\n        className={cn(\n          'fixed bottom-4 right-4 flex w-[min(22rem,calc(100vw-2rem))] flex-col-reverse gap-2',\n          '[z-index:var(--z-toast)]',\n          className,\n        )}\n        {...props}\n      />\n    </Base.Portal>\n  )\n}\n"
    }
  ]
}
