{
  "$schema": "https://ui.shadcn.com/schema/registry-item.json",
  "name": "search-field",
  "type": "registry:ui",
  "title": "Search-field",
  "description": "An Input that knows it is a search box, which is three small things the products kept not doing:\n *   - a magnifier, so the field is recognisable before it is read;   - a way to clear it that is not \"select all and delete\" - and one that a     keyboard can reach, which a decorative `<span>` cannot;   - the shortcut that focuses it, shown in the field rather than learned.",
  "dependencies": [
    "dowel-ui@^0.22.0"
  ],
  "registryDependencies": [
    "https://lacodda.github.io/dowel/r/v0.22/input.json",
    "https://lacodda.github.io/dowel/r/v0.22/kbd.json",
    "https://lacodda.github.io/dowel/r/v0.22/shortcut.json"
  ],
  "files": [
    {
      "path": "ui/search-field.tsx",
      "target": "@ui/search-field.tsx",
      "type": "registry:ui",
      "content": "import { useCallback, useRef, type InputHTMLAttributes, type Ref } from 'react'\nimport { cn } from 'dowel-ui'\nimport { fieldClasses } from './input'\nimport { Kbd } from './kbd'\nimport { useShortcut } from './shortcut'\n\n/*\n * SearchField.\n *\n * An Input that knows it is a search box, which is three small things the\n * products kept not doing:\n *\n *   - a magnifier, so the field is recognisable before it is read;\n *   - a way to clear it that is not \"select all and delete\" - and one that a\n *     keyboard can reach, which a decorative `<span>` cannot;\n *   - the shortcut that focuses it, shown in the field rather than learned.\n *\n * `type=\"search\"` is deliberate: it is what tells a browser to offer previous\n * queries, and what makes Escape clear the field on the platforms where that\n * is the convention. The browser's own clear button is hidden, because it is\n * drawn in the operating system's chrome and cannot be made to match - the\n * same reason the line does not use a native `<select>`.\n */\n\nexport interface SearchFieldProps\n  extends Omit<InputHTMLAttributes<HTMLInputElement>, 'type' | 'value' | 'onChange'> {\n  /** The query. Controlled, because a search box that owns its own text\n   * cannot be cleared by the thing that owns the results. */\n  value: string\n  /** Told the new query on every keystroke. */\n  onValueChange: (value: string) => void\n  /**\n   * What the clear button is called, for a screen reader. No default: a word\n   * the component invents is a word the product cannot translate.\n   *\n   * Leave it out and no clear button is drawn - which is the right shape for a\n   * field that filters as you type and is cleared by other means.\n   */\n  clearLabel?: string\n  /**\n   * The shortcut that focuses the field, as `['Mod', 'K']`. Shown at the right\n   * of the field, and bound: pressing it focuses and selects, from anywhere\n   * that is not already a field.\n   */\n  shortcut?: string[]\n  ref?: Ref<HTMLInputElement>\n}\n\nexport function SearchField({\n  value,\n  onValueChange,\n  clearLabel,\n  shortcut,\n  className,\n  ref,\n  ...props\n}: SearchFieldProps) {\n  const own = useRef<HTMLInputElement>(null)\n\n  const setRefs = useCallback(\n    (element: HTMLInputElement | null) => {\n      own.current = element\n      if (typeof ref === 'function') ref(element)\n      else if (ref) ref.current = element\n    },\n    [ref],\n  )\n\n  // Focus and select, so the shortcut replaces a stale query rather than\n  // appending to it. Not while someone is typing elsewhere - that is\n  // `useShortcut`'s default, and it is the half of this people forget.\n  const focusAndSelect = useCallback(() => {\n    own.current?.focus()\n    own.current?.select()\n  }, [])\n  useShortcut(shortcut ?? [], focusAndSelect, { enabled: shortcut !== undefined })\n\n  const showClear = clearLabel !== undefined && value !== ''\n\n  return (\n    <div className={cn('relative', className)}>\n      <MagnifierIcon />\n\n      <input\n        ref={setRefs}\n        type=\"search\"\n        value={value}\n        onChange={(event) => onValueChange(event.target.value)}\n        className={cn(\n          fieldClasses,\n          'h-9 pl-8',\n          // Room on the right for whatever sits there, and none when nothing\n          // does - a field with a permanent gap looks broken.\n          showClear && 'pr-8',\n          !showClear && shortcut && 'pr-14',\n          // The browser's own clear affordance, in the operating system's\n          // chrome. Ours is below.\n          '[&::-webkit-search-cancel-button]:appearance-none',\n        )}\n        {...props}\n      />\n\n      {showClear && (\n        <button\n          type=\"button\"\n          aria-label={clearLabel}\n          onClick={() => {\n            onValueChange('')\n            own.current?.focus()\n          }}\n          className={cn(\n            'absolute right-1.5 top-1/2 grid size-6 -translate-y-1/2 place-items-center',\n            'rounded-sm text-faint transition-colors hover:bg-soft hover:text-text',\n            'focus-visible:outline-2 focus-visible:outline-offset-1 focus-visible:outline-accent',\n          )}\n        >\n          <CrossIcon />\n        </button>\n      )}\n\n      {!showClear && shortcut && (\n        // Decorative: the shortcut works whether or not it is read out, and a\n        // screen reader announcing \"Control K\" inside a search box is noise.\n        <Kbd\n          keys={shortcut}\n          aria-hidden\n          className=\"pointer-events-none absolute right-2 top-1/2 -translate-y-1/2\"\n        />\n      )}\n    </div>\n  )\n}\n\nfunction MagnifierIcon() {\n  return (\n    <svg\n      viewBox=\"0 0 16 16\"\n      width=\"14\"\n      height=\"14\"\n      fill=\"none\"\n      stroke=\"currentColor\"\n      strokeWidth=\"1.6\"\n      aria-hidden\n      className=\"pointer-events-none absolute left-2.5 top-1/2 -translate-y-1/2 text-faint\"\n    >\n      <circle cx=\"7\" cy=\"7\" r=\"4.5\" />\n      <path d=\"M10.5 10.5L14 14\" strokeLinecap=\"round\" />\n    </svg>\n  )\n}\n\nfunction CrossIcon() {\n  return (\n    <svg viewBox=\"0 0 16 16\" width=\"10\" height=\"10\" fill=\"none\" stroke=\"currentColor\" strokeWidth=\"2\" aria-hidden>\n      <path d=\"M4 4l8 8M12 4l-8 8\" strokeLinecap=\"round\" />\n    </svg>\n  )\n}\n"
    }
  ]
}
