{
  "$schema": "https://ui.shadcn.com/schema/registry-item.json",
  "name": "breadcrumbs",
  "type": "registry:ui",
  "title": "Breadcrumbs",
  "description": "Where you are, as a trail rather than as a word. On a list screen the screen's own name is enough; on something opened from it, it is not - \"Works\" says nothing about which work, and the way back to the list is otherwise the browser's back button alone, which a desktop window does not visibly have.",
  "dependencies": [
    "@base-ui/react",
    "dowel-ui@^0.31.0"
  ],
  "registryDependencies": [],
  "files": [
    {
      "path": "ui/breadcrumbs.tsx",
      "target": "@ui/breadcrumbs.tsx",
      "type": "registry:ui",
      "content": "import { Fragment, type HTMLAttributes, type ReactNode } from 'react'\nimport { useRender } from '@base-ui/react/use-render'\nimport { cn } from 'dowel-ui'\n\n/*\n * Breadcrumbs.\n *\n * Where you are, as a trail rather than as a word. On a list screen the\n * screen's own name is enough; on something opened from it, it is not -\n * \"Works\" says nothing about which work, and the way back to the list is\n * otherwise the browser's back button alone, which a desktop window does not\n * visibly have.\n *\n * The last crumb is where you stand and is not a link. That is not styling:\n * it carries `aria-current=\"page\"`, so a reader hears which of the four is\n * the destination rather than a list of four places to go. Everything before\n * it is the product's own link element, given through `render` for the reason\n * the rest of the set gives it - the registry has no business installing a\n * router.\n *\n * The trail truncates from the middle when it is longer than it is wide: the\n * first crumb and the last are the two that matter, and dropping the middle\n * into an ellipsis keeps the way home and the place you are. Letting it wrap\n * onto a second line would change the height of a title bar.\n */\n\nexport interface Crumb {\n  id: string\n  label: ReactNode\n}\n\nexport interface BreadcrumbsProps extends Omit<HTMLAttributes<HTMLElement>, 'children' | 'onSelect'> {\n  /** What the trail is called for a reader - \"Breadcrumb\" by convention, but\n   * a product with two of them on one screen should say which. */\n  label: string\n  items: readonly Crumb[]\n  /** The element a crumb before the last is drawn as. Without it a crumb is a\n   * button and `onSelect` says which was pressed. */\n  render?: (item: Crumb) => useRender.RenderProp\n  onSelect?: (id: string) => void\n  /**\n   * How many crumbs are drawn before the middle is folded away. The first and\n   * the last are always kept, so this is a floor of three.\n   *\n   * The default is four, which is one more than any screen in the line\n   * actually reaches: a trail deeper than that is a sign the screens are\n   * nested more deeply than anyone will navigate.\n   */\n  max?: number\n}\n\n/** The trail with its middle folded away, and where the fold happened.\n *\n * The first crumb is kept because it is the way out, and the last because it\n * is where you are; the ellipsis stands for everything between. It is not a\n * menu: a product whose trail is regularly too long has a navigation problem\n * that a disclosure on a crumb would only hide. */\nfunction fold(items: readonly Crumb[], max: number): (Crumb | 'ellipsis')[] {\n  if (items.length <= max) return [...items]\n  // `max - 2` for the first crumb and the ellipsis, so the count the caller\n  // asked for is the count that is drawn.\n  return [items[0]!, 'ellipsis', ...items.slice(items.length - (max - 2))]\n}\n\nexport function Breadcrumbs({\n  label,\n  items,\n  render,\n  onSelect,\n  max = 4,\n  className,\n  ...props\n}: BreadcrumbsProps) {\n  const shown = fold(items, Math.max(3, max))\n\n  return (\n    <nav aria-label={label} className={cn('flex min-w-0 items-center', className)} {...props}>\n      {/* An ordered list, because the order is the meaning: a reader is told\n          \"list, 3 items\" and then hears them from the root inwards. */}\n      <ol className=\"flex min-w-0 items-center gap-1.5 text-sm\">\n        {shown.map((entry, index) => (\n          <Fragment key={entry === 'ellipsis' ? 'ellipsis' : entry.id}>\n            {index === 0 ? null : (\n              // Hidden from a reader: the separator is punctuation drawn\n              // between list items that are already announced as a list, and\n              // read aloud it becomes \"Works, greater than, Harbour lights\".\n              <li aria-hidden className=\"shrink-0 text-faint\" role=\"presentation\">\n                ›\n              </li>\n            )}\n            {entry === 'ellipsis' ? (\n              <li className=\"shrink-0 text-faint\">…</li>\n            ) : (\n              <BreadcrumbItem\n                item={entry}\n                last={index === shown.length - 1}\n                render={index === shown.length - 1 ? undefined : render?.(entry)}\n                onSelect={onSelect}\n              />\n            )}\n          </Fragment>\n        ))}\n      </ol>\n    </nav>\n  )\n}\n\nfunction BreadcrumbItem({\n  item,\n  last,\n  render,\n  onSelect,\n}: {\n  item: Crumb\n  last: boolean\n  render?: useRender.RenderProp\n  onSelect?: (id: string) => void\n}) {\n  const crumb = useRender({\n    render,\n    // Where you stand is not somewhere to go: the last crumb is text, not a\n    // control, so it is neither focusable nor announced as a link.\n    defaultTagName: last ? 'span' : 'button',\n    props: {\n      ...(render === undefined && !last ? { type: 'button' } : {}),\n      'aria-current': last ? ('page' as const) : undefined,\n      onClick: last ? undefined : () => onSelect?.(item.id),\n      className: cn(\n        'block truncate rounded-xs no-underline',\n        'focus-visible:outline-2 focus-visible:outline-offset-2 focus-visible:outline-accent',\n        last\n          ? 'font-semibold text-text'\n          : 'cursor-pointer text-dim transition-colors hover:text-text',\n      ),\n      children: item.label,\n    },\n  })\n\n  return (\n    // The crumbs before the last keep their width; the last is the one that\n    // gives, because it is the one that is a title and may be a sentence\n    // long. `min-w-0` on it so `truncate` inside has something to shrink to.\n    <li className={last ? 'min-w-0' : 'shrink-0'}>{crumb}</li>\n  )\n}\n"
    }
  ]
}
