{
  "$schema": "https://ui.shadcn.com/schema/registry-item.json",
  "name": "file-drop",
  "type": "registry:ui",
  "title": "FileDrop",
  "description": "A place to put files: drag them onto it, or press it and pick them. It takes files and hands them over - it does not upload them. Where they go, with which credentials, retried how - that is the product's transport, and a primitive that owned it would be wrong for every product whose upload does not look like the one it guessed.",
  "dependencies": [
    "dowel-ui@^0.29.0"
  ],
  "registryDependencies": [],
  "files": [
    {
      "path": "ui/file-drop.tsx",
      "target": "@ui/file-drop.tsx",
      "type": "registry:ui",
      "content": "import { useCallback, useId, useRef, useState, type DragEvent, type ReactNode } from 'react'\nimport { cn } from 'dowel-ui'\n\n/*\n * FileDrop.\n *\n * A place to put files: drag them onto it, or press it and pick them. It takes\n * files and hands them over - it does not upload them. Where they go, with\n * which credentials, retried how - that is the product's transport, and a\n * primitive that owned it would be wrong for every product whose upload does\n * not look like the one it guessed.\n *\n * The boundary is the same one `Field` draws around validation: the component\n * knows the shape of the interaction, the product knows what the interaction\n * means.\n *\n * The parts that are easy to get wrong, and are therefore here:\n *\n * - **A real `<input type=\"file\">` underneath.** Not a div with a click\n *   handler. The native input is what makes the keyboard work, what the\n *   operating system's file picker attaches to, and what a screen reader\n *   announces as a file field. It is visually hidden, not `display: none` -\n *   hidden that way it is unfocusable, and the label stops reaching it.\n * - **The drag counter.** `dragleave` fires when the pointer crosses onto a\n *   *child* of the drop zone, so a zone that toggles on leave flickers as the\n *   pointer moves over its own text. Counting enters and leaves is the fix,\n *   and it is the single commonest defect in hand-written drop zones.\n * - **`dragover` must be prevented.** Without it the browser navigates to the\n *   file instead of dropping it - the drop appears to do nothing, and the page\n *   is replaced by a PDF.\n * - **Rejected files are reported, not swallowed.** A file dropped and\n *   silently ignored looks like a broken page. What is wrong with it is the\n *   product's word, so `onReject` hands back the file and the reason.\n */\n\n/** Why a file was not accepted. The product turns this into a sentence. */\nexport type FileRejection = {\n  file: File\n  reason: 'type' | 'size' | 'count'\n}\n\nexport interface FileDropProps {\n  /** Called with the files that passed the filters. */\n  onFiles: (files: File[]) => void\n  /** Called with the ones that did not, so the product can say why. */\n  onReject?: (rejections: FileRejection[]) => void\n  /** What to take, in the form `<input accept>` uses: `image/*`, `.pdf,.docx`. */\n  accept?: string\n  /** Largest file, in bytes. */\n  maxSize?: number\n  /** How many at once. Without it, any number. */\n  maxFiles?: number\n  /** Whether several may be chosen in the picker. */\n  multiple?: boolean\n  disabled?: boolean\n  /** What the zone says. The product's words, in the product's language. */\n  children?: ReactNode\n  className?: string\n  id?: string\n  /** Names the field for a screen reader, when there is no visible label. */\n  'aria-label'?: string\n  'aria-labelledby'?: string\n  'aria-describedby'?: string\n}\n\n/** Whether a file matches an `accept` list. Handles the three forms the\n * attribute takes: an extension, a full type, and a wildcard type. */\nfunction matchesAccept(file: File, accept: string | undefined): boolean {\n  if (!accept) return true\n  return accept\n    .split(',')\n    .map((entry) => entry.trim().toLowerCase())\n    .filter(Boolean)\n    .some((entry) => {\n      if (entry.startsWith('.')) return file.name.toLowerCase().endsWith(entry)\n      if (entry.endsWith('/*')) return file.type.toLowerCase().startsWith(entry.slice(0, -1))\n      return file.type.toLowerCase() === entry\n    })\n}\n\nexport function FileDrop({\n  onFiles,\n  onReject,\n  accept,\n  maxSize,\n  maxFiles,\n  multiple,\n  disabled,\n  children,\n  className,\n  id,\n  ...aria\n}: FileDropProps) {\n  const inputRef = useRef<HTMLInputElement>(null)\n  const generatedId = useId()\n  const inputId = id ?? generatedId\n\n  /* Nested elements each fire their own enter and leave as the pointer crosses\n   * them, so a boolean would flicker while the pointer moves across the zone's\n   * own label. The depth counter is what makes \"still inside\" answerable. */\n  const [depth, setDepth] = useState(0)\n  const over = depth > 0\n\n  const take = useCallback(\n    (list: FileList | null) => {\n      if (!list) return\n      const incoming = Array.from(list)\n      const accepted: File[] = []\n      const rejected: FileRejection[] = []\n\n      for (const file of incoming) {\n        if (!matchesAccept(file, accept)) rejected.push({ file, reason: 'type' })\n        else if (maxSize !== undefined && file.size > maxSize) rejected.push({ file, reason: 'size' })\n        else if (maxFiles !== undefined && accepted.length >= maxFiles)\n          rejected.push({ file, reason: 'count' })\n        else accepted.push(file)\n      }\n\n      if (accepted.length) onFiles(accepted)\n      if (rejected.length) onReject?.(rejected)\n    },\n    [accept, maxFiles, maxSize, onFiles, onReject],\n  )\n\n  const onDrop = (event: DragEvent<HTMLDivElement>) => {\n    event.preventDefault()\n    setDepth(0)\n    if (disabled) return\n    take(event.dataTransfer.files)\n  }\n\n  return (\n    <div\n      onDragEnter={(event) => {\n        event.preventDefault()\n        setDepth((d) => d + 1)\n      }}\n      onDragLeave={(event) => {\n        event.preventDefault()\n        setDepth((d) => Math.max(0, d - 1))\n      }}\n      // Without preventing this, the browser opens the dropped file instead,\n      // and the page the reader was filling in is simply gone.\n      onDragOver={(event) => event.preventDefault()}\n      onDrop={onDrop}\n      // Presentational: the input inside is the control, and wrapping it in a\n      // second interactive element would give a screen reader two.\n      className={cn(\n        'rounded-lg border border-dashed border-line bg-raise p-6 text-center transition-colors',\n        over && !disabled && 'border-accent bg-accent-soft',\n        disabled && 'pointer-events-none opacity-50',\n        className,\n      )}\n    >\n      <label htmlFor={inputId} className={cn('block', !disabled && 'cursor-pointer')}>\n        {children}\n      </label>\n      <input\n        ref={inputRef}\n        id={inputId}\n        type=\"file\"\n        accept={accept}\n        multiple={multiple}\n        disabled={disabled}\n        {...aria}\n        onChange={(event) => {\n          take(event.target.files)\n          // Cleared so that choosing the same file twice in a row still fires\n          // a change - otherwise the second attempt silently does nothing.\n          event.target.value = ''\n        }}\n        /* Visually hidden, not `hidden`: it stays focusable, keeps its place\n         * in the tab order, and the label above still points at a real\n         * control. `display: none` would take all three away. */\n        className=\"sr-only\"\n      />\n    </div>\n  )\n}\n"
    }
  ]
}
