{
  "$schema": "https://ui.shadcn.com/schema/registry-item.json",
  "name": "skeleton-of",
  "type": "registry:ui",
  "title": "SkeletonOf",
  "description": "`Skeleton` and its shapes solved half the problem: they gave a product a list, a card and a grid to reach for instead of a spinner. The half left over is the one that actually causes the jump, and it is a human one - somebody has to look at the real thing, judge how many rows it has and how tall they are, and type that in. The judgement is made once, the screen changes a month later, and the placeholder goes on promising the old shape.",
  "dependencies": [
    "dowel-ui@^0.29.0"
  ],
  "registryDependencies": [],
  "files": [
    {
      "path": "ui/skeleton-of.tsx",
      "target": "@ui/skeleton-of.tsx",
      "type": "registry:ui",
      "content": "import { useCallback, useLayoutEffect, useRef, useState, type HTMLAttributes, type ReactNode } from 'react'\nimport { cn } from 'dowel-ui'\n\n/*\n * SkeletonOf - a placeholder that remembers the shape instead of guessing it.\n *\n * `Skeleton` and its shapes solved half the problem: they gave a product a\n * list, a card and a grid to reach for instead of a spinner. The half left\n * over is the one that actually causes the jump, and it is a human one -\n * somebody has to look at the real thing, judge how many rows it has and how\n * tall they are, and type that in. The judgement is made once, the screen\n * changes a month later, and the placeholder goes on promising the old shape.\n * The line's own calendar is the recorded case: four short lines standing in\n * for a six-row month grid, and the skeleton was itself the jump it existed to\n * prevent.\n *\n * The rule is the same one `Skeleton` is built on:\n *\n *   **A skeleton of the wrong shape is worse than no skeleton.**\n *\n * What is new here is where the shape comes from. The content was on the\n * screen a moment ago; it measured itself, and nothing else knows its shape\n * better. So this keeps what was there - how many rows, how tall each one, how\n * tall the whole block - and draws that back while the next load is in flight.\n *\n * **Why measuring and not reading the source.** The obvious version of \"derive\n * the skeleton from the markup\" is to parse the component's JSX and emit\n * boxes from it. It cannot work, and the reason is worth writing down: the\n * shape on screen is not in the source. It is the source plus the data (five\n * rows or fifty), plus the viewport (one column or three), plus the theme's\n * own spacing. A generator reading `list.tsx` sees one `<li>` in a `map` and\n * knows nothing about any of that. Measuring the rendered thing sees all of it\n * at once, and it costs a `ResizeObserver` rather than a build step.\n *\n * **The first load has nothing to remember**, and that is the case a product\n * must still answer: `fallback` is what stands in until there is a measurement\n * to use. After that the fallback is never seen again on that screen.\n *\n * Everything drawn here is `aria-hidden`, like every other skeleton - the\n * loading fact belongs to the region and is said once, by whatever owns it.\n */\n\n/** What was measured: the block's own height, and the rows inside it.\n *\n * Kept as plain numbers rather than as a copy of the DOM, because that is all\n * a placeholder needs and because a detached node would pin the whole tree in\n * memory for as long as the screen lives. */\nexport interface MeasuredShape {\n  /** The block's height when it was last full, in pixels. */\n  height: number\n  /** The height of each row inside it. Empty when nothing matched the row\n   * selector - a block with no repeating part is a single box. */\n  rows: number[]\n}\n\n/**\n * Measure a node: its height, and the heights of the rows inside it.\n *\n * Exported because a product occasionally wants the measurement without the\n * component - to persist it between sessions, for instance, so that even the\n * first load of a screen already knows its shape.\n *\n * Rows are found by selector rather than by walking children, because the\n * repeating part is rarely a direct child: a table's rows are inside a\n * `<tbody>`, a list's inside a `<ul>` that may itself be inside a scroller.\n */\nexport function measureShape(node: HTMLElement, rowSelector?: string): MeasuredShape {\n  const height = node.getBoundingClientRect().height\n  const rows = rowSelector\n    ? [...node.querySelectorAll(rowSelector)].map((row) => row.getBoundingClientRect().height)\n    : []\n  return { height, rows }\n}\n\nexport interface SkeletonOfProps extends Omit<HTMLAttributes<HTMLDivElement>, 'children'> {\n  /** Whether the content is on its way. While false the children are shown and\n   * measured; while true the remembered shape is drawn in their place. */\n  pending: boolean\n  /** The real thing. Rendered and measured when not pending. */\n  children: ReactNode\n  /**\n   * What counts as a row - `'tr'`, `'li'`, `'[data-row]'`. Given, the\n   * placeholder draws one box per row at the height that row had; omitted, it\n   * draws a single box the height of the whole block.\n   */\n  rowSelector?: string\n  /**\n   * What to draw before anything has been measured - the first load of a\n   * screen, where there is genuinely nothing to remember. A `SkeletonList` of\n   * roughly the right size is the usual answer.\n   */\n  fallback?: ReactNode\n  /**\n   * A shape measured earlier - from `measureShape`, stored by the product\n   * between sessions. Used until this instance measures something itself, so\n   * even a first load can be honest.\n   */\n  shape?: MeasuredShape\n  /** The gap between drawn rows, as a Tailwind class. Matches whatever the\n   * real list uses; the rows' own heights come from the measurement. */\n  gapClassName?: string\n}\n\n/**\n * Shows the children, remembers their shape, and draws that shape back while\n * the next load is in flight.\n *\n * The measurement is taken in a layout effect and on every resize, not once on\n * mount: a list that gains rows, a window that narrows, a font that loads late\n * all change the shape, and a placeholder built from the first measurement\n * would be wrong in exactly the way this component exists to prevent.\n */\nexport function SkeletonOf({\n  pending,\n  children,\n  rowSelector,\n  fallback,\n  shape,\n  gapClassName,\n  className,\n  ...props\n}: SkeletonOfProps) {\n  const [measured, setMeasured] = useState<MeasuredShape | undefined>(shape)\n  const node = useRef<HTMLDivElement | null>(null)\n\n  const remember = useCallback(() => {\n    const element = node.current\n    if (!element) return\n    const next = measureShape(element, rowSelector)\n    // A block of no height is a block that has not been laid out - a hidden\n    // tab, a parent still collapsing. Remembering a zero would draw nothing\n    // and claim it was the shape.\n    if (next.height <= 0) return\n    setMeasured((held) =>\n      held && held.height === next.height && sameRows(held.rows, next.rows) ? held : next,\n    )\n  }, [rowSelector])\n\n  useLayoutEffect(() => {\n    // Only the branch that renders the content carries the ref, so while\n    // pending there is nothing to measure and `remember` finds no node. That\n    // is what keeps the memory from decaying: measuring the placeholder would\n    // record the shape it had just drawn from memory, and each load would\n    // remember a little less of what the content actually looked like.\n    //\n    // It is worth stating rather than relying on, because it rests on React\n    // clearing a ref when the node it points at unmounts. The guard below is\n    // that fact made explicit - if the component ever renders both branches,\n    // this is the line that keeps the loop from closing.\n    if (pending || !node.current) return\n    remember()\n\n    // jsdom has no ResizeObserver, and a product may run in one. The component\n    // is still correct without it: it has the mount measurement, it just does\n    // not follow later changes.\n    if (typeof ResizeObserver === 'undefined') return\n    const element = node.current\n    if (!element) return\n    const observer = new ResizeObserver(remember)\n    observer.observe(element)\n    return () => observer.disconnect()\n  }, [pending, remember, children])\n\n  if (!pending) {\n    return (\n      <div ref={node} className={className} {...props}>\n        {children}\n      </div>\n    )\n  }\n\n  // Nothing measured yet, and nothing handed over: the first load of a screen\n  // that did not say what it is waiting for. Saying nothing is better than\n  // drawing a shape made up on the spot.\n  if (!measured) return <>{fallback ?? null}</>\n\n  return (\n    <div aria-hidden className={cn('flex flex-col', gapClassName ?? 'gap-1', className)} {...props}>\n      {measured.rows.length > 0 ? (\n        measured.rows.map((height, row) => (\n          <div\n            key={row}\n            style={{ height }}\n            className=\"animate-pulse shrink-0 rounded-md bg-soft\"\n          />\n        ))\n      ) : (\n        <div style={{ height: measured.height }} className=\"animate-pulse rounded-md bg-soft\" />\n      )}\n    </div>\n  )\n}\n\n/** Whether two row measurements are the same run of heights.\n *\n * Compared rather than replaced wholesale so that a resize that changes\n * nothing does not hand back a new object every frame - which would re-render\n * the subtree on every pixel of a window drag. */\nfunction sameRows(left: number[], right: number[]): boolean {\n  return left.length === right.length && left.every((height, index) => height === right[index])\n}\n"
    }
  ]
}
