{
  "$schema": "https://ui.shadcn.com/schema/registry-item.json",
  "name": "preview-card",
  "type": "registry:ui",
  "title": "PreviewCard",
  "description": "The card that appears when a link is hovered: who the author is, what the issue says, what is behind the URL. Rich content - an avatar, a few lines, a figure or two - rather than the phrase a Tooltip holds.",
  "dependencies": [
    "@base-ui/react",
    "class-variance-authority",
    "dowel-ui@^0.38.0"
  ],
  "registryDependencies": [
    "https://lacodda.github.io/dowel/r/v0.38/layer.json"
  ],
  "files": [
    {
      "path": "ui/preview-card.tsx",
      "target": "@ui/preview-card.tsx",
      "type": "registry:ui",
      "content": "import { PreviewCard as Base } from '@base-ui/react/preview-card'\nimport { cva, type VariantProps } from 'class-variance-authority'\nimport { cn } from 'dowel-ui'\nimport { usePopupContainer } from './layer'\n\n/*\n * PreviewCard.\n *\n * The card that appears when a link is hovered: who the author is, what the\n * issue says, what is behind the URL. Rich content - an avatar, a few lines,\n * a figure or two - rather than the phrase a Tooltip holds.\n *\n * Positioned the same way a Popover is, through a Positioner between the\n * Portal and the Popup, so it flips and shifts to stay on screen. What differs\n * is how it opens: hovering the trigger, after a delay, and it stays open\n * while the pointer travels from the link to the card. That last part is the\n * whole trick - a card that vanishes when the pointer leaves the link cannot\n * be read, let alone clicked into.\n *\n * Same warning as Tooltip, and for the same reason. Base UI treats this as a\n * visual enhancement for sighted mouse and keyboard users: it is not reachable\n * on a touch screen and not announced by a screen reader. So NOTHING IN THE\n * CARD MAY BE THE ONLY PLACE IT APPEARS. Everything in it has to also be on\n * the page the link goes to - the card is a shortcut for people who can see\n * it, never the delivery mechanism for the information itself.\n *\n * If the content has to be reachable by everyone, this is the wrong component;\n * a Popover opened from a real button is the right one.\n */\n\nexport const previewCardPopupVariants = cva(\n  [\n    'rounded-lg border border-line bg-raise p-4 text-sm text-text shadow-raise',\n    'focus-visible:outline-none',\n    // The enter and the leave. `duration-*` reads the token directly because\n    // Tailwind's own utility takes a literal number.\n    '[transition:opacity_var(--duration-base)_var(--ease-out),transform_var(--duration-base)_var(--ease-out)]',\n    'data-[closed]:scale-[0.97] data-[closed]:opacity-0',\n    'data-[starting-style]:scale-[0.97] data-[starting-style]:opacity-0',\n    // Grow out of the edge it is anchored to rather than out of its own\n    // middle, so the motion points back at the link.\n    'origin-[var(--transform-origin)]',\n  ],\n  {\n    variants: {\n      size: {\n        sm: 'w-[min(18rem,calc(100vw-2rem))]',\n        md: 'w-[min(22rem,calc(100vw-2rem))]',\n        lg: 'w-[min(28rem,calc(100vw-2rem))]',\n      },\n    },\n    defaultVariants: { size: 'md' },\n  },\n)\n\n/** The root. Controlled with `open` and `onOpenChange`, or left to manage\n * itself around a `PreviewCardTrigger`. */\nexport const PreviewCard = Base.Root\n\n/** The link the card previews. Usually rendered as the anchor itself, so it\n * stays a real link: it navigates, it opens in a new tab, and a screen reader\n * announces it as one - which is what the card cannot do. Takes `delay`. */\nexport const PreviewCardTrigger = Base.Trigger\n\nexport interface PreviewCardPopupProps\n  extends Base.Popup.Props,\n    VariantProps<typeof previewCardPopupVariants> {\n  /** Preferred side of the link. Base UI flips it when it does not fit, and\n   * defaults it to the bottom. */\n  side?: Base.Positioner.Props['side']\n  /** Alignment along that side. Base UI centres it by default. */\n  align?: Base.Positioner.Props['align']\n  /** Distance from the link, in pixels. */\n  sideOffset?: Base.Positioner.Props['sideOffset']\n  /** Whether to draw the arrow pointing back at the link. */\n  arrow?: boolean\n  /** Where to portal to. Defaults to the raised host of the overlay this is\n   * opened inside (`layer.tsx`), and to the document body when there is none -\n   * either way not the element it was opened from, whose `overflow` would clip\n   * it. Pass an element to put it somewhere else, such as a container being\n   * screenshotted. */\n  container?: Base.Portal.Props['container']\n}\n\n/** The card. Portalled and positioned, so it is not clipped by the paragraph\n * the link sits in. */\nexport function PreviewCardPopup({\n  size,\n  side,\n  align,\n  sideOffset = 8,\n  arrow = true,\n  container,\n  className,\n  children,\n  ...props\n}: PreviewCardPopupProps) {\n  // Inside an overlay, the overlay's raised host rather than the body - or\n  // this popup draws under the dialog, drawer or popover that opened it. See\n  // `layer.tsx`. Outside every overlay the hook gives `undefined`: the body.\n  const host = usePopupContainer()\n\n  return (\n    <Base.Portal container={container ?? host}>\n      <Base.Positioner\n        side={side}\n        align={align}\n        sideOffset={sideOffset}\n        className=\"[z-index:var(--z-floating)]\"\n      >\n        <Base.Popup className={cn(previewCardPopupVariants({ size }), className)} {...props}>\n          {arrow ? <PreviewCardArrow /> : null}\n          {children}\n        </Base.Popup>\n      </Base.Positioner>\n    </Base.Portal>\n  )\n}\n\n/** The notch pointing back at the link. Base UI rotates it to whatever side\n * the card landed on, which is why the placement is keyed off `data-side`\n * rather than off the `side` that was asked for. */\nexport function PreviewCardArrow({ className, ...props }: Base.Arrow.Props) {\n  return (\n    <Base.Arrow\n      className={cn(\n        'h-2 w-2 rotate-45 border border-line bg-raise',\n        'data-[side=bottom]:-top-1 data-[side=bottom]:border-r-0 data-[side=bottom]:border-b-0',\n        'data-[side=top]:-bottom-1 data-[side=top]:border-t-0 data-[side=top]:border-l-0',\n        'data-[side=left]:-right-1 data-[side=left]:border-b-0 data-[side=left]:border-l-0',\n        'data-[side=right]:-left-1 data-[side=right]:border-r-0 data-[side=right]:border-t-0',\n        className,\n      )}\n      {...props}\n    />\n  )\n}\n"
    }
  ]
}
