{
  "$schema": "https://ui.shadcn.com/schema/registry-item.json",
  "name": "field",
  "type": "registry:ui",
  "title": "Field",
  "description": "Every form is the same four parts repeated: a name for the control, the control, sometimes a hint, and sometimes an error. Written by hand each time, they drift - the label loses its `htmlFor`, the hint is a `<div>` no screen reader mentions, the error appears in red and is announced by nothing at all. This is that arrangement, once.",
  "dependencies": [
    "@base-ui/react",
    "dowel-ui@^0.23.0"
  ],
  "registryDependencies": [],
  "files": [
    {
      "path": "ui/field.tsx",
      "target": "@ui/field.tsx",
      "type": "registry:ui",
      "content": "import type { ReactElement, ReactNode } from 'react'\nimport { Field as Base } from '@base-ui/react/field'\nimport { cn } from 'dowel-ui'\n\n/*\n * Field - the label, the control, and what the form has to say about it.\n *\n * Every form is the same four parts repeated: a name for the control, the\n * control, sometimes a hint, and sometimes an error. Written by hand each\n * time, they drift - the label loses its `htmlFor`, the hint is a `<div>` no\n * screen reader mentions, the error appears in red and is announced by\n * nothing at all. This is that arrangement, once.\n *\n * The wiring is the point, and Base UI does it: the label points at the\n * control, the description and the error are named by `aria-describedby`, and\n * the control is marked invalid while an error is showing. None of that is\n * visible when it works, which is exactly why a product stops doing it.\n *\n * `error` is a string this is given, not a rule this enforces. dowel has no\n * opinion about where the string came from - Base UI's own `validate`, a\n * schema, react-hook-form, or a server that just said no - because a design\n * system that picked a form library would be choosing for products that\n * already chose. The one thing it insists on is that an error, once it\n * exists, is announced and points at the field it belongs to.\n *\n * The label is always rendered. A field whose name is only a placeholder\n * loses that name the moment someone types, and a placeholder is not a label\n * to anything that reads the page aloud; `labelHidden` takes it off the\n * screen and leaves it in the accessibility tree.\n */\n\nexport interface FieldProps {\n  /** What the control is called. Always rendered; `labelHidden` only takes it\n   * off the screen. */\n  label: ReactNode\n  /** The control itself - Input, Textarea, Select, Checkbox, anything.\n   *\n   * A single element rather than arbitrary nodes, because it is handed to\n   * Base UI to carry the field's id and its `aria-*` wiring. Two children, or\n   * a bare string, would leave the label naming nothing. */\n  children: ReactElement\n  /** A hint under the control. Hidden while an error is showing: two lines of\n   * small print under one field is one line too many, and the error is the\n   * one that matters. */\n  help?: ReactNode\n  /** What is wrong, if anything. Its presence is what marks the control\n   * invalid - there is no separate `invalid` prop to keep in step. */\n  error?: ReactNode\n  /** Keep the label for screen readers but take it off the screen. For a\n   * field whose meaning is obvious in context - a search box in a toolbar. */\n  labelHidden?: boolean\n  className?: string\n  /** Marks the field required, which is a statement about the form rather\n   * than about validation: the label gets the mark a reader looks for. */\n  required?: boolean\n  /** The control's `name`, forwarded so a `Form` can attach a server error to\n   * this field by name. */\n  name?: string\n  disabled?: boolean\n}\n\nexport function Field({\n  label,\n  children,\n  help,\n  error,\n  labelHidden = false,\n  className,\n  required = false,\n  name,\n  disabled = false,\n}: FieldProps) {\n  const invalid = error !== undefined && error !== null && error !== false\n\n  return (\n    <Base.Root\n      name={name}\n      disabled={disabled}\n      // Base UI marks the control invalid from its own validity state; this\n      // says so for an error that arrived from anywhere else.\n      invalid={invalid || undefined}\n      className={cn('flex flex-col gap-1.5', className)}\n    >\n      <Base.Label\n        className={cn(\n          'text-2xs font-medium uppercase tracking-caption text-faint',\n          // Off the screen, still in the accessibility tree. Not\n          // `display: none`, which would take it out of both.\n          labelHidden && 'sr-only',\n        )}\n      >\n        {label}\n        {required && (\n          <span aria-hidden className=\"ml-0.5 text-bad\">\n            *\n          </span>\n        )}\n      </Base.Label>\n\n      {/* The control is handed to Base UI rather than merely nested inside\n        * it. This is the whole component: a plain child renders a label whose\n        * `for` points at an id nothing carries, so the label looks wired and\n        * names nothing - which is exactly the bug this exists to prevent, and\n        * it is invisible in a screenshot. `render` gives the child the id,\n        * `aria-labelledby` and `aria-describedby` instead. */}\n      <Base.Control render={children} />\n\n      {/* The error wins the one line under the control. `match` is not used:\n        * the string is already the decision - this renders whatever it was\n        * handed rather than asking the browser what is wrong. */}\n      {invalid ? (\n        <Base.Error className=\"text-xs text-bad\" match>\n          {error}\n        </Base.Error>\n      ) : (\n        help !== undefined && <Base.Description className=\"text-xs text-dim\">{help}</Base.Description>\n      )}\n    </Base.Root>\n  )\n}\n"
    }
  ]
}
